{
  "schemaVersion": "evergreen.registry.v2",
  "ecosystem": "rust",
  "freshness": {
    "maxReviewAgeDays": 45
  },
  "rules": [
    {
      "id": "rust.toolchain.end-of-support-1.98-and-older",
      "ecosystem": "rust",
      "purl": "pkg:generic/rust",
      "vers": "vers:semver/<1.99.0",
      "event": "end-of-support",
      "title": "Rust 1.98 and older are no longer supported",
      "summary": "The Rust project only provides support and security updates for the most recent stable release, so a release line is unsupported once the next stable release ships. Rust 1.99 was released on 2026-10-01.",
      "severity": "medium",
      "replacement": "The latest stable Rust release",
      "deadline": "2026-10-01",
      "sources": [
        {
          "title": "Rust security policy",
          "url": "https://www.rust-lang.org/policies/security"
        },
        {
          "title": "Rust release notes (release dates)",
          "url": "https://github.com/rust-lang/rust/blob/master/RELEASES.md"
        }
      ],
      "provenance": {
        "observedAt": "2026-10-17",
        "reviewedAt": "2026-10-17",
        "reviewer": "arminazimi"
      },
      "migration": {
        "constraints": [
          "Keep the toolchain in rust-toolchain(.toml), CI (for example dtolnay/rust-toolchain or rustup), and container images on one supported release.",
          "Check the project's MSRV (`rust-version`) separately: raising the toolchain does not require raising it."
        ],
        "steps": [
          {
            "id": "update-toolchain-pin",
            "title": "Raise the pinned toolchain",
            "instructions": "Change the reported channel in rust-toolchain(.toml) to the latest stable release, or to `stable`, so the project follows supported releases.",
            "targets": "declaration"
          },
          {
            "id": "align-toolchain-surfaces",
            "title": "Align other toolchain surfaces",
            "instructions": "Update CI toolchain setup and Dockerfile `rust:` images so they match the new release.",
            "targets": "all"
          }
        ],
        "verification": [
          {
            "command": "rustc --version",
            "purpose": "Confirm the active toolchain is the intended release."
          },
          {
            "command": "cargo build --all-targets && cargo test",
            "purpose": "Build and test every target on the new toolchain."
          },
          {
            "command": "cargo clippy --all-targets",
            "purpose": "Review the lints the newer toolchain reports."
          }
        ]
      }
    },
    {
      "id": "rust.crate.failure.unmaintained",
      "ecosystem": "rust",
      "purl": "pkg:cargo/failure",
      "vers": "vers:cargo/*",
      "event": "deprecated",
      "title": "failure is no longer maintained",
      "summary": "The failure crate is officially end-of-life: its former maintainer marked it deprecated and announced there will be no further updates or maintenance.",
      "severity": "medium",
      "replacement": "anyhow, eyre, fehler, or snafu",
      "sources": [
        {
          "title": "RustSec advisory RUSTSEC-2020-0036",
          "url": "https://rustsec.org/advisories/RUSTSEC-2020-0036.html"
        }
      ],
      "provenance": {
        "observedAt": "2026-10-17",
        "reviewedAt": "2026-10-17",
        "reviewer": "arminazimi"
      },
      "migration": {
        "constraints": [
          "Keep error types, `Display` output, and public error conversions stable for callers of this crate."
        ],
        "steps": [
          {
            "id": "replace-failure",
            "title": "Replace failure",
            "instructions": "Replace failure with anyhow for application errors or thiserror/snafu for library error types, and update `Fail` derives, `failure::Error`, and `format_err!` uses.",
            "targets": "all"
          }
        ],
        "verification": [
          {
            "command": "cargo build --all-targets && cargo test",
            "purpose": "Build and test after the error-handling change."
          }
        ]
      },
      "usage": [
        {
          "kind": "import",
          "language": "rust",
          "module": "failure"
        },
        {
          "kind": "call",
          "language": "rust",
          "module": "failure",
          "targets": [
            "err_msg",
            "format_err",
            "bail",
            "ensure"
          ]
        }
      ]
    },
    {
      "id": "rust.crate.tempdir.unmaintained",
      "ecosystem": "rust",
      "purl": "pkg:cargo/tempdir",
      "vers": "vers:cargo/*",
      "event": "deprecated",
      "title": "tempdir is no longer maintained",
      "summary": "The tempdir crate has been deprecated and its functionality merged into tempfile.",
      "severity": "medium",
      "replacement": "tempfile",
      "sources": [
        {
          "title": "RustSec advisory RUSTSEC-2018-0017",
          "url": "https://rustsec.org/advisories/RUSTSEC-2018-0017.html"
        }
      ],
      "provenance": {
        "observedAt": "2026-10-17",
        "reviewedAt": "2026-10-17",
        "reviewer": "arminazimi"
      },
      "migration": {
        "constraints": [
          "Keep temporary directories cleaned up on drop, as before."
        ],
        "steps": [
          {
            "id": "replace-tempdir",
            "title": "Replace tempdir with tempfile",
            "instructions": "Replace the tempdir dependency with tempfile and change `TempDir::new(prefix)` calls to `tempfile::tempdir()` or `tempfile::Builder`.",
            "targets": "all"
          }
        ],
        "verification": [
          {
            "command": "cargo build --all-targets && cargo test",
            "purpose": "Build and run the tests that create temporary directories."
          }
        ]
      },
      "usage": [
        {
          "kind": "import",
          "language": "rust",
          "module": "tempdir"
        },
        {
          "kind": "call",
          "language": "rust",
          "module": "tempdir",
          "targets": [
            "TempDir::new"
          ]
        }
      ]
    },
    {
      "id": "rust.crate.atty.unmaintained",
      "ecosystem": "rust",
      "purl": "pkg:cargo/atty",
      "vers": "vers:cargo/*",
      "event": "deprecated",
      "title": "atty is no longer maintained",
      "summary": "The maintainer of atty has published an official notice that the crate is no longer under development and that users should rely on the standard library's IsTerminal trait.",
      "severity": "medium",
      "replacement": "std::io::IsTerminal (stable since Rust 1.70), or the is-terminal crate for older compilers",
      "sources": [
        {
          "title": "RustSec advisory RUSTSEC-2024-0375",
          "url": "https://rustsec.org/advisories/RUSTSEC-2024-0375.html"
        }
      ],
      "provenance": {
        "observedAt": "2026-10-17",
        "reviewedAt": "2026-10-17",
        "reviewer": "arminazimi"
      },
      "migration": {
        "constraints": [
          "Preserve how colored or interactive output is chosen when stdout or stderr is not a terminal."
        ],
        "steps": [
          {
            "id": "replace-atty",
            "title": "Use std::io::IsTerminal",
            "instructions": "Replace `atty::is(Stream::Stdout)` with `std::io::stdout().is_terminal()` (stable since Rust 1.70, `use std::io::IsTerminal`), or use the is-terminal crate on older compilers, and remove the atty dependency.",
            "targets": "all"
          }
        ],
        "verification": [
          {
            "command": "cargo build --all-targets && cargo test",
            "purpose": "Build and test after removing atty."
          }
        ]
      },
      "usage": [
        {
          "kind": "import",
          "language": "rust",
          "module": "atty"
        },
        {
          "kind": "call",
          "language": "rust",
          "module": "atty",
          "targets": [
            "is",
            "isnt"
          ]
        }
      ]
    },
    {
      "id": "rust.crate.ansi-term.unmaintained",
      "ecosystem": "rust",
      "purl": "pkg:cargo/ansi_term",
      "vers": "vers:cargo/*",
      "event": "deprecated",
      "title": "ansi_term is no longer maintained",
      "summary": "The maintainer has advised that ansi_term is deprecated and will not receive any maintenance.",
      "severity": "medium",
      "replacement": "A maintained terminal-styling crate (the advisory lists unvetted alternatives such as anstyle, nu-ansi-term, owo-colors, and console)",
      "sources": [
        {
          "title": "RustSec advisory RUSTSEC-2021-0139",
          "url": "https://rustsec.org/advisories/RUSTSEC-2021-0139.html"
        }
      ],
      "provenance": {
        "observedAt": "2026-10-17",
        "reviewedAt": "2026-10-17",
        "reviewer": "arminazimi"
      },
      "migration": {
        "constraints": [
          "Keep the same colors and styles in terminal output."
        ],
        "steps": [
          {
            "id": "replace-ansi-term",
            "title": "Replace ansi_term",
            "instructions": "Replace ansi_term with a maintained styling crate (the advisory lists anstyle, nu-ansi-term, owo-colors, and console as unvetted options) and update `Style`, `Colour`, and `ANSIString` uses.",
            "targets": "all"
          }
        ],
        "verification": [
          {
            "command": "cargo build --all-targets && cargo test",
            "purpose": "Build and test after the styling change."
          }
        ]
      },
      "usage": [
        {
          "kind": "import",
          "language": "rust",
          "module": "ansi_term"
        }
      ]
    }
  ]
}
