{
  "schemaVersion": "evergreen.registry.v2",
  "ecosystem": "swift",
  "freshness": {
    "maxReviewAgeDays": 90
  },
  "rules": [
    {
      "id": "swift.xcode.app-store-below-15",
      "ecosystem": "swift",
      "purl": "pkg:generic/xcode",
      "vers": "vers:semver/<15.0.0",
      "event": "end-of-support",
      "title": "Xcode older than 15 is not accepted for App Store uploads",
      "summary": "Apps uploaded to App Store Connect must be built with Xcode 15 for iOS 17, iPadOS 17, tvOS 17, or watchOS 10 starting April 29, 2024.",
      "severity": "high",
      "replacement": "Xcode 26 or later",
      "deadline": "2024-04-29",
      "sources": [
        {
          "title": "Xcode 15 — App Store upcoming requirements",
          "url": "https://developer.apple.com/news/upcoming-requirements/?id=04292024a"
        }
      ],
      "provenance": {
        "observedAt": "2026-10-19",
        "reviewedAt": "2026-10-19",
        "reviewer": "arminazimi"
      },
      "migration": {
        "constraints": [
          "Keep .xcode-version, CI Xcode selections, and local installs on one Xcode release that App Store Connect still accepts.",
          "Later App Store SDK minimums also require newer Xcode lines; plan to land on the current minimum (see the replacement)."
        ],
        "steps": [
          {
            "id": "raise-xcode-pin",
            "title": "Raise the Xcode pin",
            "instructions": "Change the reported .xcode-version (or equivalent CI Xcode version) from the rejected line to a release App Store Connect accepts (see the replacement).",
            "targets": "declaration"
          },
          {
            "id": "align-xcode-surfaces",
            "title": "Align other Xcode surfaces",
            "instructions": "Update CI macOS/Xcode images and documented install steps so they match the new pin.",
            "targets": "all"
          }
        ],
        "verification": [
          {
            "command": "xcodebuild -version",
            "purpose": "Confirm the active Xcode is the intended release."
          },
          {
            "command": "xcodebuild -scheme \"$(basename \"$PWD\")\" -destination 'generic/platform=iOS' build",
            "purpose": "Build with the new Xcode before uploading to App Store Connect."
          },
          {
            "command": "swift build && swift test",
            "purpose": "Build and test the Swift package on the toolchain that matches the new Xcode."
          }
        ]
      }
    },
    {
      "id": "swift.xcode.app-store-15-through-25",
      "ecosystem": "swift",
      "purl": "pkg:generic/xcode",
      "vers": "vers:semver/>=15.0.0|<26.0.0",
      "event": "end-of-support",
      "title": "Xcode 15 through 25 are not accepted for App Store uploads",
      "summary": "Since April 28, 2026. Apps uploaded to App Store Connect must be built with Xcode 26 or later using an SDK for iOS 26, iPadOS 26, tvOS 26, visionOS 26, or watchOS 26.",
      "severity": "high",
      "replacement": "Xcode 26 or later",
      "deadline": "2026-04-28",
      "sources": [
        {
          "title": "SDK minimum requirements — App Store upcoming requirements (Xcode 26)",
          "url": "https://developer.apple.com/news/upcoming-requirements/?id=04282026a"
        }
      ],
      "provenance": {
        "observedAt": "2026-10-19",
        "reviewedAt": "2026-10-19",
        "reviewer": "arminazimi"
      },
      "migration": {
        "constraints": [
          "Keep .xcode-version, CI Xcode selections, and local installs on one Xcode release that App Store Connect still accepts."
        ],
        "steps": [
          {
            "id": "raise-xcode-pin",
            "title": "Raise the Xcode pin",
            "instructions": "Change the reported .xcode-version (or equivalent CI Xcode version) from the 15–25 line to Xcode 26 or later.",
            "targets": "declaration"
          },
          {
            "id": "align-xcode-surfaces",
            "title": "Align other Xcode surfaces",
            "instructions": "Update CI macOS/Xcode images and documented install steps so they match the new pin.",
            "targets": "all"
          }
        ],
        "verification": [
          {
            "command": "xcodebuild -version",
            "purpose": "Confirm the active Xcode is the intended release."
          },
          {
            "command": "xcodebuild -scheme \"$(basename \"$PWD\")\" -destination 'generic/platform=iOS' build",
            "purpose": "Build with the new Xcode before uploading to App Store Connect."
          },
          {
            "command": "swift build && swift test",
            "purpose": "Build and test the Swift package on the toolchain that matches the new Xcode."
          }
        ]
      }
    },
    {
      "id": "swift.app-store.ios-below-13",
      "ecosystem": "swift",
      "purl": "pkg:generic/ios",
      "vers": "vers:semver/<13.0.0",
      "event": "end-of-support",
      "title": "iOS and iPadOS app targets below iOS 13 are not accepted for App Store uploads",
      "summary": "Since September 9, 2026, iOS and iPadOS apps uploaded to App Store Connect must target iOS 13 or later.",
      "severity": "high",
      "replacement": "iOS 13 or later",
      "deadline": "2026-09-09",
      "sources": [
        {
          "title": "iOS and iPadOS minimum system requirements — App Store upcoming requirements",
          "url": "https://developer.apple.com/news/upcoming-requirements/?id=0992026a"
        }
      ],
      "provenance": {
        "observedAt": "2026-10-20",
        "reviewedAt": "2026-10-20",
        "reviewer": "arminazimi"
      },
      "migration": {
        "constraints": [
          "Set the deployment target on the app target that is uploaded, not on a library or Swift package: libraries that declare an older platforms minimum are not changed by this rule.",
          "Raising the minimum removes iOS releases from the app's audience, and can remove APIs the app relies on; keep the minimum your users still run at or above 13."
        ],
        "steps": [
          {
            "id": "raise-deployment-target",
            "title": "Raise the iOS deployment target",
            "instructions": "Set IPHONEOS_DEPLOYMENT_TARGET on each build configuration of the app target to 13.0 or later (see the replacement), and keep it consistent across Debug and Release.",
            "targets": "declaration"
          },
          {
            "id": "align-deployment-surfaces",
            "title": "Align other deployment surfaces",
            "instructions": "Update the minimum version in documentation, release notes, and any App Store Connect or TestFlight metadata that names the old minimum.",
            "targets": "all"
          }
        ],
        "verification": [
          {
            "command": "xcodebuild -showBuildSettings -scheme \"$(basename \"$PWD\")\" | grep IPHONEOS_DEPLOYMENT_TARGET",
            "purpose": "Confirm the app target resolves to the raised deployment target."
          },
          {
            "command": "xcodebuild -scheme \"$(basename \"$PWD\")\" -destination 'generic/platform=iOS' build",
            "purpose": "Build the app for iOS with the raised deployment target before uploading."
          }
        ]
      }
    }
  ]
}
